{
  "schema_version": 1,
  "signature_valid": true,
  "generation": "staging-generation-1",
  "revocation_generation": "staging-revocation-1",
  "approved_registry": "registry.example.test",
  "approved_repository": "registry.example.test/gowa",
  "platform": "linux/amd64",
  "signature": {
    "algorithm": "ed25519",
    "key_id": "staging-fixture-key",
    "value": "go3Clbh8BtOOhnUFVkB4lyuOJ8N/ICBCTWTtsQJpj8XMZuRpnM78EPYNl7rjnIZ3891g4NZNlydozk9I5GhtBA=="
  },
  "releases": [
    {
      "release_id": "gowa-v9-2-2",
      "version": "v9.2.2",
      "image": "registry.example.test/gowa@sha256:d4411a6e3f197ffc830ac5be9a055dec5756e8199cacd028d989f8ae657435fc",
      "digest": "sha256:d4411a6e3f197ffc830ac5be9a055dec5756e8199cacd028d989f8ae657435fc",
      "approved": true,
      "revoked": false,
      "revocation_generation": "staging-revocation-1"
    }
  ]
}
